{
  "id": "base:the_bar_crowd_in_a_hurry",
  "type": "customer_archetype",
  "name": "loc:archetype.the_bar_crowd_in_a_hurry",
  "budget": [
    8.82,
    67.13
  ],
  "patience": 1.77,
  "wants": [
    "drink"
  ],
  "spawn_weight": 0.68,
  "shifts": [
    "evening",
    "event_night"
  ],
  "fraud_propensity": 0.182,
  "age_range": [
    21,
    55
  ],
  "tags": [
    "watchlist_candidate"
  ]
}
